{
  "schema_version": "1.0",
  "instance_id": "n005w4_H0-n005w4-1_WD-n005w4-8_week0",
  "scenario_id": "n005w4",
  "horizon_weeks": 4,
  "week_index": 0,
  "days": [
    "Mon",
    "Tue",
    "Wed",
    "Thu",
    "Fri",
    "Sat",
    "Sun"
  ],
  "skills": [
    "HeadNurse",
    "Nurse"
  ],
  "shift_types": [
    {
      "name": "Early",
      "min_consecutive": 2,
      "max_consecutive": 5
    },
    {
      "name": "Late",
      "min_consecutive": 2,
      "max_consecutive": 3
    },
    {
      "name": "Night",
      "min_consecutive": 4,
      "max_consecutive": 5
    }
  ],
  "forbidden_successions": {
    "Early": [],
    "Late": [
      "Early"
    ],
    "Night": [
      "Early",
      "Late"
    ]
  },
  "contracts": {
    "FullTime": {
      "total_assignments": {
        "min": 15,
        "max": 22
      },
      "consecutive_work_days": {
        "min": 3,
        "max": 5
      },
      "consecutive_days_off": {
        "min": 2,
        "max": 3
      },
      "max_working_weekends": 2,
      "complete_weekends": true
    },
    "PartTime": {
      "total_assignments": {
        "min": 7,
        "max": 11
      },
      "consecutive_work_days": {
        "min": 3,
        "max": 5
      },
      "consecutive_days_off": {
        "min": 3,
        "max": 5
      },
      "max_working_weekends": 2,
      "complete_weekends": true
    }
  },
  "nurses": [
    {
      "id": "Patrick",
      "contract": "FullTime",
      "skills": [
        "HeadNurse",
        "Nurse"
      ]
    },
    {
      "id": "Andrea",
      "contract": "FullTime",
      "skills": [
        "HeadNurse",
        "Nurse"
      ]
    },
    {
      "id": "Stefaan",
      "contract": "PartTime",
      "skills": [
        "HeadNurse",
        "Nurse"
      ]
    },
    {
      "id": "Sara",
      "contract": "PartTime",
      "skills": [
        "Nurse"
      ]
    },
    {
      "id": "Nguyen",
      "contract": "FullTime",
      "skills": [
        "Nurse"
      ]
    }
  ],
  "history": {
    "Patrick": {
      "total_assignments": 0,
      "working_weekends": 0,
      "last_shift": "Early",
      "consecutive_same_shift": 2,
      "consecutive_work_days": 2,
      "consecutive_days_off": 0
    },
    "Andrea": {
      "total_assignments": 0,
      "working_weekends": 0,
      "last_shift": "Night",
      "consecutive_same_shift": 2,
      "consecutive_work_days": 4,
      "consecutive_days_off": 0
    },
    "Stefaan": {
      "total_assignments": 0,
      "working_weekends": 0,
      "last_shift": "Late",
      "consecutive_same_shift": 1,
      "consecutive_work_days": 4,
      "consecutive_days_off": 0
    },
    "Sara": {
      "total_assignments": 0,
      "working_weekends": 0,
      "last_shift": "Late",
      "consecutive_same_shift": 2,
      "consecutive_work_days": 2,
      "consecutive_days_off": 0
    },
    "Nguyen": {
      "total_assignments": 0,
      "working_weekends": 0,
      "last_shift": "Off",
      "consecutive_same_shift": 0,
      "consecutive_work_days": 0,
      "consecutive_days_off": 2
    }
  },
  "coverage": [
    {
      "day": "Mon",
      "shift": "Early",
      "skill": "HeadNurse",
      "minimum": 0,
      "preferred": 0
    },
    {
      "day": "Tue",
      "shift": "Early",
      "skill": "HeadNurse",
      "minimum": 1,
      "preferred": 1
    },
    {
      "day": "Wed",
      "shift": "Early",
      "skill": "HeadNurse",
      "minimum": 0,
      "preferred": 0
    },
    {
      "day": "Thu",
      "shift": "Early",
      "skill": "HeadNurse",
      "minimum": 0,
      "preferred": 0
    },
    {
      "day": "Fri",
      "shift": "Early",
      "skill": "HeadNurse",
      "minimum": 1,
      "preferred": 1
    },
    {
      "day": "Sat",
      "shift": "Early",
      "skill": "HeadNurse",
      "minimum": 1,
      "preferred": 1
    },
    {
      "day": "Sun",
      "shift": "Early",
      "skill": "HeadNurse",
      "minimum": 0,
      "preferred": 0
    },
    {
      "day": "Mon",
      "shift": "Early",
      "skill": "Nurse",
      "minimum": 1,
      "preferred": 1
    },
    {
      "day": "Tue",
      "shift": "Early",
      "skill": "Nurse",
      "minimum": 1,
      "preferred": 1
    },
    {
      "day": "Wed",
      "shift": "Early",
      "skill": "Nurse",
      "minimum": 1,
      "preferred": 1
    },
    {
      "day": "Thu",
      "shift": "Early",
      "skill": "Nurse",
      "minimum": 0,
      "preferred": 1
    },
    {
      "day": "Fri",
      "shift": "Early",
      "skill": "Nurse",
      "minimum": 1,
      "preferred": 1
    },
    {
      "day": "Sat",
      "shift": "Early",
      "skill": "Nurse",
      "minimum": 0,
      "preferred": 1
    },
    {
      "day": "Sun",
      "shift": "Early",
      "skill": "Nurse",
      "minimum": 1,
      "preferred": 1
    },
    {
      "day": "Mon",
      "shift": "Late",
      "skill": "HeadNurse",
      "minimum": 0,
      "preferred": 1
    },
    {
      "day": "Tue",
      "shift": "Late",
      "skill": "HeadNurse",
      "minimum": 0,
      "preferred": 0
    },
    {
      "day": "Wed",
      "shift": "Late",
      "skill": "HeadNurse",
      "minimum": 1,
      "preferred": 1
    },
    {
      "day": "Thu",
      "shift": "Late",
      "skill": "HeadNurse",
      "minimum": 1,
      "preferred": 1
    },
    {
      "day": "Fri",
      "shift": "Late",
      "skill": "HeadNurse",
      "minimum": 0,
      "preferred": 0
    },
    {
      "day": "Sat",
      "shift": "Late",
      "skill": "HeadNurse",
      "minimum": 0,
      "preferred": 0
    },
    {
      "day": "Sun",
      "shift": "Late",
      "skill": "HeadNurse",
      "minimum": 0,
      "preferred": 0
    },
    {
      "day": "Mon",
      "shift": "Late",
      "skill": "Nurse",
      "minimum": 1,
      "preferred": 1
    },
    {
      "day": "Tue",
      "shift": "Late",
      "skill": "Nurse",
      "minimum": 1,
      "preferred": 1
    },
    {
      "day": "Wed",
      "shift": "Late",
      "skill": "Nurse",
      "minimum": 1,
      "preferred": 1
    },
    {
      "day": "Thu",
      "shift": "Late",
      "skill": "Nurse",
      "minimum": 0,
      "preferred": 1
    },
    {
      "day": "Fri",
      "shift": "Late",
      "skill": "Nurse",
      "minimum": 1,
      "preferred": 1
    },
    {
      "day": "Sat",
      "shift": "Late",
      "skill": "Nurse",
      "minimum": 1,
      "preferred": 1
    },
    {
      "day": "Sun",
      "shift": "Late",
      "skill": "Nurse",
      "minimum": 1,
      "preferred": 1
    },
    {
      "day": "Mon",
      "shift": "Night",
      "skill": "HeadNurse",
      "minimum": 0,
      "preferred": 1
    },
    {
      "day": "Tue",
      "shift": "Night",
      "skill": "HeadNurse",
      "minimum": 0,
      "preferred": 0
    },
    {
      "day": "Wed",
      "shift": "Night",
      "skill": "HeadNurse",
      "minimum": 0,
      "preferred": 0
    },
    {
      "day": "Thu",
      "shift": "Night",
      "skill": "HeadNurse",
      "minimum": 0,
      "preferred": 0
    },
    {
      "day": "Fri",
      "shift": "Night",
      "skill": "HeadNurse",
      "minimum": 0,
      "preferred": 1
    },
    {
      "day": "Sat",
      "shift": "Night",
      "skill": "HeadNurse",
      "minimum": 0,
      "preferred": 0
    },
    {
      "day": "Sun",
      "shift": "Night",
      "skill": "HeadNurse",
      "minimum": 0,
      "preferred": 0
    },
    {
      "day": "Mon",
      "shift": "Night",
      "skill": "Nurse",
      "minimum": 0,
      "preferred": 1
    },
    {
      "day": "Tue",
      "shift": "Night",
      "skill": "Nurse",
      "minimum": 1,
      "preferred": 1
    },
    {
      "day": "Wed",
      "shift": "Night",
      "skill": "Nurse",
      "minimum": 1,
      "preferred": 1
    },
    {
      "day": "Thu",
      "shift": "Night",
      "skill": "Nurse",
      "minimum": 0,
      "preferred": 1
    },
    {
      "day": "Fri",
      "shift": "Night",
      "skill": "Nurse",
      "minimum": 1,
      "preferred": 1
    },
    {
      "day": "Sat",
      "shift": "Night",
      "skill": "Nurse",
      "minimum": 1,
      "preferred": 1
    },
    {
      "day": "Sun",
      "shift": "Night",
      "skill": "Nurse",
      "minimum": 1,
      "preferred": 1
    }
  ],
  "shift_off_requests": [
    {
      "nurse_id": "Andrea",
      "day": "Tue",
      "shift": "Any"
    }
  ],
  "sources": {
    "scenario": {
      "path": "inrc2/n005w4/Sc-n005w4.txt",
      "sha256": "8b8ae0dc7ff31ba5d7865d5a82d5efac636c833013e88fead05a2eacdba8a121"
    },
    "history": {
      "path": "inrc2/n005w4/H0-n005w4-1.txt",
      "sha256": "3c4b8d51cf95360dccdbb1bd0270d625d0546cee14419b6de2dff2504b55ad7c"
    },
    "week_data": {
      "path": "inrc2/n005w4/WD-n005w4-8.txt",
      "sha256": "06c471a8702d5eb95dbdccdcc54d3045bd658398c9eac66e115770315ddad538"
    }
  }
}
